<?xml version="1.0" encoding="UTF-8"?><webPages xmlns="http://www.example.org/webPages" xsi:schemaLocation="http://www.example.org/webPages webPages.xsd" xmlns:xsi="http://www.w3.org/2001/XMLSchema-instance"><webPage id="ID-3"><title>Habr</title><webPageType>NEWS_WEB_PAGE</webPageType><needAuthorization>false</needAuthorization><chars><votingAvailable>true</votingAvailable><votingType>ANONYMOUS</votingType><paidInformation>false</paidInformation><emailAvailable>false</emailAvailable><numberOfNews>15</numberOfNews></chars></webPage><webPage id="ID-2"><title>Yandex</title><webPageType>PORTAL_WEB_PAGE</webPageType><needAuthorization>false</needAuthorization><chars><votingAvailable>true</votingAvailable><votingType>ANONYMOUS</votingType><paidInformation>false</paidInformation><emailAvailable>true</emailAvailable></chars></webPage><webPage id="ID-1"><title>webPage</title><webPageType>MIRROR_WEB_PAGE</webPageType><needAuthorization>false</needAuthorization><chars><votingAvailable>true</votingAvailable><votingType>OPEN_VOTE</votingType><paidInformation>false</paidInformation><emailAvailable>true</emailAvailable><archiveAvailable>false</archiveAvailable></chars></webPage><webPage id="ID-4"><title>webPage</title><webPageType>ADVERTISING_WEB_PAGE</webPageType><needAuthorization>false</needAuthorization><chars><votingAvailable>false</votingAvailable><votingType>UNAPPROACHABLE</votingType><paidInformation>true</paidInformation></chars></webPage></webPages>